{
  "$schema": "https://raw.githubusercontent.com/ShivamH1/sfactory/main/schema/config.json",
  "project": "acme",
  "agents": {
    "mode": "mixed",
    "claude": { "plan": "opus/high", "review": "opus/high", "judge": "opus/high", "implement": "sonnet", "triage": "haiku" },
    "codex": { "implement": "implement", "review": "review" }
  },
  "stateDir": "../worktrees/_sfactory",
  "worktrees": {
    "dir": "../worktrees",
    "branchPrefix": "feature/",
    "baseRule": "newest-feature-branch",
    "integrationBranch": "development",
    "afterCut": ["pnpm install"],
    "copyFromBase": ["apps/admin/.env", "apps/web/.env"],
    "copyForVerify": ["apps/api/.env"]
  },
  "commands": {
    "suite": "pnpm test",
    "suiteSerial": true,
    "build": "pnpm build",
    "typecheck": ["pnpm --filter @acme/web exec tsc -b --force", "pnpm --filter @acme/admin exec tsc -b --force"],
    "migrate": "pnpm migrate:deploy",
    "services": [
      { "name": "api", "cmd": "pnpm --filter @acme/api exec tsx src/server.ts", "port": "api", "env": { "PORT": "{port.api}", "CORS_ORIGIN": "http://localhost:{port.web}", "WEB_APP_URL": "http://localhost:{port.web}" } },
      { "name": "worker", "cmd": "pnpm --filter @acme/api exec tsx src/worker.ts", "live": true },
      { "name": "web", "cmd": "pnpm --filter @acme/web dev --port {port.web}", "env": { "VITE_API_URL": "http://localhost:{port.api}" } }
    ]
  },
  "ports": { "base": 4100, "step": 100, "names": ["api", "admin", "web"] },
  "record": {
    "style": "spec-tree",
    "stories": "spec/product/FEATURE_STORIES_*.md",
    "brief": "spec/modules/{n}-{slug}.md",
    "plan": "spec/plans/{n}-{slug}.md",
    "log": "spec/decisions/{n}-{slug}.md",
    "carriedForward": "spec/modules/19.1-CARRIED-FORWARD.md",
    "postCloseHeading": "# Post-close work carried on this branch",
    "numbering": "next-milestone-number"
  },
  "rules": ["CLAUDE.md", "AGENTS.md"],
  "hotspots": ["CLAUDE.md", "AGENTS.md", "spec/modules/19.1-CARRIED-FORWARD.md", "packages/core", "apps/api/src/app.ts"],
  "migrations": { "dir": "apps/api/prisma/migrations", "appliedTo": "one shared dev database" },
  "fixCardRefusals": ["apps/api/prisma/**", "spec/modules/**"],
  "stops": ["awaiting-approval", "decision-needed"],
  "limits": { "parallelMilestones": 2, "parallelTasks": 4, "fixRounds": 3, "taskRounds": 3 },
  "git": { "trailers": false, "namedPathsOnly": true, "push": true, "merge": false },
  "secrets": { "neverHandToAgents": ["apps/api/.env"] },
  "board": { "port": 4317, "pollMs": 2000 }
}
